{
  "id": "gap-report-project-1",
  "projectId": "project-1",
  "structureId": "video-structure-project-1",
  "inventoryId": "inventory-project-1",
  "slotMatches": [],
  "missingSlots": [
    {
      "slotId": "seg-hook-hook_visual-1",
      "reason": "无商品特写或 hook 视觉素材",
      "impact": "high",
      "suggestedFixes": ["image_generation"]
    }
  ],
  "weakSlots": [
    {
      "slotId": "seg-cta-cta-1",
      "reason": "文案可覆盖 CTA，但转化导向的视觉包装不足",
      "impact": "high",
      "suggestedFixes": ["hyperframes_material"]
    },
    {
      "slotId": "seg-hook-hook_text-2",
      "reason": "hook 文字仅有弱匹配文案",
      "impact": "medium",
      "suggestedFixes": ["hyperframes_material"]
    },
    {
      "slotId": "seg-2-benefit_card-1",
      "reason": "卖点卡缺少包装化视觉",
      "impact": "medium",
      "suggestedFixes": ["hyperframes_material"]
    },
    {
      "slotId": "seg-3-proof-1",
      "reason": "proof 槽位缺少实拍对比画面",
      "impact": "medium",
      "suggestedFixes": ["hyperframes_material"]
    }
  ],
  "summary": "1 missing, 4 weak slots"
}
